"id","date","day","favorites","retweets","title","url","author","score"
"476072685768683520",2014-06-09,"Monday",2,0,"moRe","http://t.co/eZhdiSUUwe","Patrick",2
"475927226941054976",2014-06-09,"Monday",4,1,"Science-y New Year’s Resolution:  Learn to Code","http://t.co/8N0plrreop","Patrick",6
"476135460779991042",2014-06-09,"Monday",11,10,"Reproducible research is still a challenge","http://t.co/jlWJGc77fu","rOpenSci Blog - R",31
"476036060254715904",2014-06-09,"Monday",0,0,"AlienVault Longitudinal Study Part 4","http://t.co/wtZAfU0sAI","Steve Patton (@spttnnh)",0
"476002078184062976",2014-06-09,"Monday",1,1,"Rcpp 0.11.2","http://t.co/eZtdNCcEB4","Thinking inside the box",3
"475882523138867200",2014-06-09,"Monday",0,1,"The luckiest team in the NBA","http://t.co/M91Mjy3LvD","tlfvincent",2
"475686236447711232",2014-06-08,"Sunday",6,0,"slumping model","http://t.co/QqrrgwuizH","Dan Kelley Blog/R",6
"475686258912403456",2014-06-08,"Sunday",19,5,"using C++ within R","http://t.co/oXK6BB1BhO","Dan Kelley Blog/R",29
"475613462417408000",2014-06-08,"Sunday",2,2,"useR! 2014 conference update","http://t.co/1Ca3iw0SG9","David Smith",6
"475447427009224706",2014-06-08,"Sunday",5,2,"subset vectors in Rcpp11","http://t.co/Pp9bgqenXR","romain francois",9
"475433485977399297",2014-06-08,"Sunday",4,0,"Paris, June 2014 - Portfolio Design Tutorial","http://t.co/J6qq5BHbeh","wuertz",4
"475409623524974592",2014-06-07,"Saturday",18,11,"Reading data from the new version of Google Spreadsheets","http://t.co/18GQb2HEIC","Andrie de Vries",40
"475299968937242624",2014-06-07,"Saturday",7,2,"Can You Track Me Now? (Visualizing Xfinity Wi-Fi Hotspot Coverage) [Part 1]","http://t.co/vwYCsUvINm","Bob Rudis (@hrbrmstr)",11
"475258520011423744",2014-06-07,"Saturday",7,10,"A million new R users","http://t.co/KIocZTbLG5","David Smith",27
"475092462793289728",2014-06-07,"Saturday",8,2,"On the relevance of open source analytics","http://t.co/you9wKs1IU","David Smith",12
"475258466357895168",2014-06-07,"Saturday",1,0,"Reflections on the China R User Conference","http://t.co/bspCnvsU2O","David Smith",1
"475072712230977536",2014-06-07,"Saturday",4,0,"rCharts Parcoords x Simpsons x Blocks","http://t.co/JJ0hI7PW9j","Jo-fai Chow",4
"475169293684846593",2014-06-07,"Saturday",10,6,"R style tip: prefer functions that return data frames","http://t.co/BOQHbfJAOG","John Mount",22
"475258491364311040",2014-06-07,"Saturday",12,5,"Deep Learning at Stanford","http://t.co/FXvgIglsYi","Joseph Rickert",22
"474957706185285633",2014-06-06,"Friday",12,5,"Concatenating a list of data frames","http://t.co/7t93WXDGDu","andrew",22
"474867343269457920",2014-06-06,"Friday",5,2,"Tolerance and numerical analysis","http://t.co/IpAEAVi3y4","Brian Rowe",9
"474761555792236545",2014-06-06,"Friday",4,2,"More on TV Ads and Presidential Elections","http://t.co/hykyV1hPXT","Daniel Marcelino",8
"475048275259576320",2014-06-06,"Friday",5,4,"Female hurricanes reloaded – another reanalysis of Jung et al.","http://t.co/Lypbb7nYeV","Florian Hartig",13
"474800587909783552",2014-06-06,"Friday",6,1,"2014 World Cup Squads","http://t.co/EPh9PJrSJE","gjabel",8
"474746439562584064",2014-06-06,"Friday",5,1,"str Implementation for Data Frames","http://t.co/GG4Txa2spQ","Jason Bryer",7
"474650665034072064",2014-06-05,"Thursday",3,2,"Identifying pathways for managing multiple disturbances to limit plant invasions","http://t.co/oLT5JRNeCr","andrew",7
"474673310912225280",2014-06-05,"Thursday",27,12,"A simple workflow for using R with Microsoft Office products","http://t.co/5QwdcgQRBA","beckmw",51
"474587744925003776",2014-06-05,"Thursday",4,1,"Stuff I’ve gotten horribly wrong","http://t.co/m65JPUWxLW","PirateGrunt",6
"462025599582609408",2014-05-02,"Friday",9,6,"Test coverage of the 10 most downloaded R packages","http://t.co/bIGSSR1WUr","R2D2",21
"462127277765955585",2014-05-02,"Friday",6,2,"Searching an R Function’s Source Code","http://t.co/s5FO70iprI","wrathematics",10
"462282695477706752",2014-05-02,"Friday",11,3,"Multidimensional Scaling (MDS) with R","http://t.co/JWtANeiAtV","Yanchang Zhao",17
"461808461617983490",2014-05-01,"Thursday",12,8,"Converting shapefiles to rasters in R","http://t.co/uUWhyrk7WW","Amy Whitehead",28
"461952173513789440",2014-05-01,"Thursday",2,2,"Plotting Microtiter Plate Maps","http://t.co/0YbWu3V7r9","Brian Connelly",6
"462008016707928065",2014-05-01,"Thursday",15,7,"A bit of the agenda of Practical Data Science with R","http://t.co/o9LEmDPbcu","John Mount",29
"462008016015876096",2014-05-01,"Thursday",4,0,"Importing a log file with rxImport()","http://t.co/J4hmp6VjOq","Joseph Rickert",4
"461781508135460864",2014-05-01,"Thursday",0,0,"Shiny variance inflation factor sandbox","http://t.co/uvVQtHynoz","Maxwell B. Joseph",0
"461618608339030016",2014-04-30,"Wednesday",0,0,"Registration now open for useR! 2014 in LA","http://t.co/KCROGkYEy8","David Smith",0
"461363479895494656",2014-04-30,"Wednesday",30,6,"Writing an R package from scratch: As I have worked on various projects at Etsy, I have accumulated a ...","http://t.co/Dq3lVvjapN","hilaryparker",42
"461616244748066816",2014-04-30,"Wednesday",4,1,"A Shiny-app Serves as Shiny-server Load Balancer","http://t.co/ev8mH2YXvP","Huidong Tian",6
"461338115529912320",2014-04-30,"Wednesday",5,0,"Slidify Old Book Images from Google Books","http://t.co/6ikMzOmGzk","klr",5
"461539952065400832",2014-04-30,"Wednesday",33,10,"Decision making trees and machine learning resources for R","http://t.co/D3uATRKeBE","Marc in the box",53
"461384900575121408",2014-04-30,"Wednesday",7,2,"brainR: Put your brain on the Cloud!","http://t.co/yHqWcv8Jny","strictlystat",11
"461423898978832384",2014-04-30,"Wednesday",2,0,"visualization methods in ChIPseeker","http://t.co/CGOxCOzLRx","ygc",2
"460951997139533824",2014-04-29,"Tuesday",1,2,"RStudio and X2Go","http://t.co/W2Gd0n9bVd","Forester",5
"460990707063218176",2014-04-29,"Tuesday",5,1,"Data Until I Die: My blog title and statement of values","http://t.co/5rIlAc4kZI","inkhorn82",7
"461184511946915840",2014-04-29,"Tuesday",11,4,"Predict which shoppers will become repeat buyers","http://t.co/XX0wrEl8LQ","Joseph Rickert",19
"461150522301362176",2014-04-29,"Tuesday",2,1,"On the trade history and dynamics of NBA teams","http://t.co/k97KWEtlWj","tlfvincent",4
"460848939088896000",2014-04-28,"Monday",2,0,"Hazardous and Benign Space Objects: Getting the Data","http://t.co/kcNrEIPbYf","andrew",2
"460740322327150592",2014-04-28,"Monday",9,5,"What Can Go Wrong:  My Favorite Example","http://t.co/JD5hUStM2u","matloff",19
"460673967544479744",2014-04-28,"Monday",16,1,"Floating table of contents for your html reports using knitr","http://t.co/GJCP84DhT9","steve",18
"460881440213700608",2014-04-28,"Monday",1,8,"userR!2014 at UCLA is open for registration: The Organizing Committee of userR!2014 at UCLA, to be hel...","http://t.co/yhayWc8wzv","Tal Galili",17
"460528971906416640",2014-04-27,"Sunday",4,0,"Introducing Statwing","http://t.co/dIMYFgkde2","Abbas Keshvani",4
"460347743714562048",2014-04-27,"Sunday",3,1,"Project Tycho, Correlation between states","http://t.co/Z8CUbOCyTR","Wingfeet",5
"460099972810014720",2014-04-26,"Saturday",35,14,"Great Resource for Teaching Statistics with R","http://t.co/nSqDbuBS3F","Dave Giles",63
"460053282514165761",2014-04-26,"Saturday",7,1,"AISTATS 2014 / MLSS tutorial","http://t.co/37QEUuqheq","xi'an",9
"460197052052287488",2014-04-26,"Saturday",2,1,"Le Monde puzzle [#869]","http://t.co/Qbm8N45yXs","xi'an",4
"459797956065914880",2014-04-25,"Friday",0,0,"Making Better DNS TXT Record Lookups With Rcpp","http://t.co/TkwWYjVuyl","Bob Rudis (@hrbrmstr)",0
"459695999401738241",2014-04-25,"Friday",12,3,"Shout out to ""R Handles Big Data""","http://t.co/boPGaNNFOD","Francis Smart",18
"459781493678563328",2014-04-25,"Friday",6,1,"Moving From system() calls to Rcpp Interfaces","http://t.co/2lQmbvGHYS","hrbrmstr",8
"459742504695238656",2014-04-25,"Friday",4,0,"Example 2014.5: Simple mean imputation","http://t.co/cK3Ype5vnK","Ken Kleinman",4
"459635554980610049",2014-04-25,"Friday",10,3,"Bandit Formulations for A/B Tests: Some Intuition","http://t.co/w851CdzdZ8","Nina Zumel",16
"459761435736674304",2014-04-25,"Friday",3,2,"Stats in bed, part 1: Ubuntu Touch","http://t.co/6bG1Fx4v7W","Robert",7
"459441791217856512",2014-04-24,"Thursday",3,0,"Analysis of Copper and Equity Prices on the http://t.co/Kbur5ItZO0 blog","http://t.co/PyCllU8DUW","Cory Lesmeister",3
"459402806844084224",2014-04-24,"Thursday",3,0,"2014 Brazilian Election","http://t.co/6gScsqHVBh","Daniel Marcelino",3
"459474596123516928",2014-04-24,"Thursday",3,4,"R Helps With Employee Churn: 
by Joseph Rickert
Pasha Roberts, Chief Scientist at Talent Analytics, is...","http://t.co/863U1Dv4Jn","Joseph Rickert",11
"459234196083335168",2014-04-24,"Thursday",0,0,"All the Factors | More Looks","http://t.co/sVDOpVEQyg","klr",0
"459241720266240000",2014-04-24,"Thursday",11,4,"Publishing an R package in the Journal of Statistical Software","http://t.co/AmHQuZC0Qm","Rob J Hyndman",19
"459402807418695681",2014-04-24,"Thursday",2,0,"Preventing escaping in HTML","http://t.co/DoWMoMSrgZ","suman",2
"458904796750036992",2014-04-23,"Wednesday",6,2,"Yet Another Baseball Defense Statistic","http://t.co/3il2j20SRL","Andrew Landgraf",10
"458855444253900800",2014-04-23,"Wednesday",9,2,"Simpson’s Paradox in a nutshell","http://t.co/66enUOoSNb","David Smith",13
"458992628202078209",2014-04-23,"Wednesday",4,1,"Some fun (and insights) with facbook’s graph API","http://t.co/m1XMCklfKY","Stefan Weigert",6
"459094633629237248",2014-04-23,"Wednesday",4,3,"Benchmarking RRE and SAS","http://t.co/aZzSG6v8uI","Thomas W DInsmore",10
"458537115651821568",2014-04-22,"Tuesday",3,4,"Notes from the Tokyo R User Group meeting, 17 April 2014","http://t.co/c3RGZicmSA","Markus Gesmann",11
"458519568516804609",2014-04-22,"Tuesday",11,4,"Seven forecasting blogs","http://t.co/ssU8ZRuzcn","Rob J Hyndman",19
"458738554365960193",2014-04-22,"Tuesday",5,2,"Announcing RStudio Shiny Server Pro v1.1","http://t.co/xz8V2L06eI","Roger Oberg",9
"458040116439564288",2014-04-21,"Monday",2,1,"R-3.1.0 + OpenBLAS Speed Comparisons","http://t.co/AeWWnrtNbm","Avraham Adler",4
"458301956935520256",2014-04-21,"Monday",10,3,"Free interactive R exercises on OpenIntro","http://t.co/xE0ipuerZM","DataCamp",16
"458301957627596800",2014-04-21,"Monday",4,0,"Modified lencat() — Increased Flexibility with dplyr","http://t.co/PbocndgGXE","dogle",4
"458304365212618752",2014-04-21,"Monday",6,1,"Exploring Factors with rCharts and factorAnalytics","http://t.co/LVav20S0kJ","klr",8
"458202443105320960",2014-04-21,"Monday",2,0,"The Circus Tent Problem with R’s Quadprog","http://t.co/QmXroOoiZP","Ryan Walker",2
"458304364306636800",2014-04-21,"Monday",4,0,"Fracking and House Prices on the Marcellus Shale","http://t.co/l1fgcJEIJC","Thiemo Fetzer",4
"458202444619460608",2014-04-21,"Monday",2,0,"High incidence in Measles Data in Project Tycho","http://t.co/bYjHi4MOuR","Wingfeet",2
"457776077985705985",2014-04-20,"Sunday",6,6,"OpenCPU release 1.3 and 1.4","http://t.co/AfLtcaVpTq","Jeroen Ooms",18
"457671336802795520",2014-04-20,"Sunday",7,6,"Play 2048… using R!","http://t.co/XMqoZl4AGH","Mark T Patterson",19
"457415909477343233",2014-04-19,"Saturday",12,0,"Tips &amp; Tricks 3: Ordering Datasets Alphabetically","http://t.co/VV6jw0CGtx","Emma Sherratt",12
"457320437018394624",2014-04-19,"Saturday",1,0,"My talks @ Universitat de Girona","http://t.co/ABAlpHrtch","Gianluca Baio",1
"457633696216932352",2014-04-19,"Saturday",5,0,"The Current Golden Era of the NBA","http://t.co/evmi6LIJVK","jlebeau",5
"457344331301392384",2014-04-19,"Saturday",4,0,"Old tails: a crude power law fit on ebook sales","http://t.co/mZniCAfUpv","John Mount",4
"456984335191523328",2014-04-18,"Friday",4,1,"Database for chronic malignancies","http://t.co/1xDjukEp0f","suman",6
"456984336391086080",2014-04-18,"Friday",7,3,"Publishing in GitHub","http://t.co/mZdoKaY6cw","suman",13
"457204674781655041",2014-04-18,"Friday",16,3,"Date formating in R","http://t.co/1eVVBUxN1V","The R Trader",22
"457163040396300288",2014-04-18,"Friday",3,0,"Reot: Empirical Orthogonal Teleconnections in R","http://t.co/LDsFxxD4dZ","Tim Salabim",3
"456857380165152769",2014-04-17,"Thursday",4,1,"Diving into H2O","http://t.co/Ybit92rfQY","Joseph Rickert",6
"456857378961387521",2014-04-17,"Thursday",16,4,"Make your ggplots shareable, collaborative, and with D3","http://t.co/TivcEqUPMC","rOpenSci Blog - R",24
"456531326946906112",2014-04-16,"Wednesday",24,6,"Using R — Working with Geospatial Data (and ggplot2)","http://t.co/9RVJwUWwVi","Bethany Yollin",36
"456580544751357953",2014-04-16,"Wednesday",4,0,"Bitsanity","http://t.co/3WDX4MQ9xh","Francis Smart",4
"456361466476498944",2014-04-16,"Wednesday",4,1,"Wealth and Skill | A Talk to Students","http://t.co/m9c0gcyGC9","klr",6
"456501426030514176",2014-04-16,"Wednesday",17,14,"Vectorization in R: Why?","http://t.co/gkiLtj7XuG","Noam Ross",45
"456433209731850240",2014-04-16,"Wednesday",1,1,"Errors on percentage errors","http://t.co/aKu0Kx45NN","Rob J Hyndman",3
"456361467252441088",2014-04-16,"Wednesday",5,4,"Accessing Open Data Portal (India) using APIs","http://t.co/ygVgbjfxvn","steadyfish",13
"456137646390005760",2014-04-15,"Tuesday",9,1,"Quantitative Finance Applications in R – 5: an Introduction to Monte Carlo Simulation: 

(This articl...","http://t.co/mka5E09RjF","Joseph Rickert",11
"456107295848427520",2014-04-15,"Tuesday",5,1,"googleVis 0.5.1 released on CRAN","http://t.co/3DeP4onCMW","Markus Gesmann",7
"456045920681877504",2014-04-15,"Tuesday",9,4,"Use of freqparcoord for Regression Diagnostics","http://t.co/MSbx1zieir","matloff",17
"455977341177446402",2014-04-15,"Tuesday",1,0,"BH release 1.54.0-2","http://t.co/OOc5QMWTYf","Thinking inside the box",1
"455748720055681024",2014-04-14,"Monday",2,0,"Transitioning to Stan","http://t.co/Q06TzvChoG","andrew",2
"455532311207870464",2014-04-14,"Monday",10,5,"Open Science Through R","http://t.co/Gbh3Zt2UZW","Dave Giles",20
"455783902808797184",2014-04-14,"Monday",9,7,"Interfacing R with Web technologies","http://t.co/EJ8cd4GuOS","David Smith",23
"455664376372948992",2014-04-14,"Monday",10,15,"Public Universities Should Use Open Source Software","http://t.co/S49wBRrTfp","Francis Smart",40
"455602162400129024",2014-04-14,"Monday",14,2,"Regular expressions in R vs RStudio","http://t.co/BTigTgMEqg","Robin Lovelace - R",18
"455134700151926785",2014-04-13,"Sunday",10,0,"GeoCoding, R, and The Rolling Stones – Part 1","http://t.co/evGCFNRt1a","steve",10
"455342256900145152",2014-04-13,"Sunday",5,0,"Following open courseware","http://t.co/kqvfxI7xni","Wingfeet",5
"455465695023599617",2014-04-13,"Sunday",3,0,"ChIPseeker for ChIP peak annotation","http://t.co/qthMLHPVYL","ygc",3
"455060495079194624",2014-04-12,"Saturday",9,2,"Heatmap of Toronto Traffic Signals using RGoogleMaps","http://t.co/LlTjJIDqtU","Myles Harrison",13
"454797439321399298",2014-04-12,"Saturday",10,3,"Fortran and R – Speed Things Up","http://t.co/lUNiJRJlZ1","steve",16
"454813747622584320",2014-04-12,"Saturday",8,2,"Visualize violent crime rates in US with choroplethr package","http://t.co/GnvE3z8lOm","teramonagi",12
"454993956191756288",2014-04-12,"Saturday",4,1,"chart with individual signals","http://t.co/sQalObGqBv","Thomas Huben",6
"454963510636580864",2014-04-12,"Saturday",16,2,"Shape File Selfies in ggplot2","http://t.co/lBBqIYYXkz","tylerrinker",20
"454823868067098624",2014-04-12,"Saturday",1,0,"Le Monde sans puzzle [&amp; sans penguins]","http://t.co/x8SMmiV0f5","xi'an",1
"454711891709788160",2014-04-11,"Friday",3,1,"Largest Volcanoes in Recorded History (and other statistics)","http://t.co/5OYCYpgbz0","andrew",5
"454711893295263744",2014-04-11,"Friday",7,4,"Create an impressionist self-portrait from your Twitter followers","http://t.co/mIlHxjMm7p","David Smith",15
"454514371440295938",2014-04-11,"Friday",16,3,"Side-by-Side Box Plots with Patterns From Data Sets Stacked by reshape2 and melt() in R: 

(This arti...","http://t.co/PEYBcvd1vk","Eric Cai - The Chemica...",22
"454601319282515968",2014-04-11,"Friday",5,0,"About Data","http://t.co/dUHY4xnQ1t","ibartomeus",5
"454713075468210176",2014-04-11,"Friday",1,0,"Find it Humorous … “Not So Bad” in the “long-term”","http://t.co/OrZpctVWcd","klr",1
"454711892544475136",2014-04-11,"Friday",4,1,"And the most loyal fans in the NBA are…","http://t.co/IVNr5UA7BM","tlfvincent",6
"454299305260486657",2014-04-10,"Thursday",6,1,"“Pretty” table columns","http://t.co/ictyWDOIQT","aghaynes",8
"454231330323066880",2014-04-10,"Thursday",5,0,"The Pythagorean Tree Is In Bloom","http://t.co/SsUWAUWr0r","aschinchon",5
"454173301481275392",2014-04-10,"Thursday",12,1,"Animated Choropleths in R","http://t.co/7CkebqH9ol","David Smith",14
"454320625658494976",2014-04-10,"Thursday",11,2,"Announcing our new training web pages","http://t.co/PhiVTBHiUk","Garrett.Grolemund",15
"454329961730424832",2014-04-10,"Thursday",2,14,"R 3.1.0 is released!","http://t.co/hDGWnjNmqa","Tal Galili",30
"453925442928394240",2014-04-09,"Wednesday",10,4,"Calculating confidence intervals for proportions","http://t.co/NFhGC136NN","aghaynes",18
"453983403474317313",2014-04-09,"Wednesday",2,0,"categoryCompare Paper Finally Out!","http://t.co/XqqYgyFWPG","Deciphering life: One ...",2
"453897710370705408",2014-04-09,"Wednesday",4,3,"Shiny-server System Performance Monitoring for Open Source Edition","http://t.co/r2fbdZQmBI","Huidong Tian",10
"453731642364805120",2014-04-09,"Wednesday",5,1,"How do I open R help about a symbol or punctuation mark like ( parenthesis or [ bracket?: 

(This art...","http://t.co/niAtRNLiY4","Isomorphismes",7
"453813450959888384",2014-04-09,"Wednesday",0,0,"BH release 1.54.0-1","http://t.co/xGaK0fnQ9u","Thinking inside the box",0
"453516658225598465",2014-04-08,"Tuesday",5,3,"JMBayes R package (webinar)","http://t.co/WVzc9j2YTb","Bob Muenchen",11
"453602264549425152",2014-04-08,"Tuesday",1,1,"Get notified when R packages update","http://t.co/FKLAFK7jir","DataCamp",3
"453534056324407296",2014-04-08,"Tuesday",3,1,"devtools 1.5","http://t.co/UMn9KWsPVn","hadleywickham",5
"453615658240991233",2014-04-08,"Tuesday",3,1,"Annotation charts and histograms with googleVis","http://t.co/sNb66k2oYD","Markus Gesmann",5
"453370538971238400",2014-04-08,"Tuesday",1,0,"Job at Center for Open Science","http://t.co/QGA3UJKrwt","Rob J Hyndman",1
"453373015661633536",2014-04-08,"Tuesday",6,4,"Quality of Historical Stock Prices from Yahoo Finance","http://t.co/pHLyorzIR3","systematicinvestor",14
"453478919023259648",2014-04-08,"Tuesday",1,0,"RcppArmadillo 0.4.200.0","http://t.co/rJiKSVChMh","Thinking inside the box",1
"453478919711109120",2014-04-08,"Tuesday",1,0,"Importing Business Climate Index from IFO","http://t.co/7KwhpFrYXM","Thomas Huben",1
"453325287678148608",2014-04-08,"Tuesday",1,0,"data scientist position","http://t.co/O8wu06X81b","xi'an",1
"453160369813344256",2014-04-07,"Monday",3,0,"Earthquake Magnitude / Depth Chart","http://t.co/qcjc3T7eL8","andrew",3
"453185794337824768",2014-04-07,"Monday",3,5,"R Continues Its Rapid Growth","http://t.co/QfBumoHTZV","Bob Muenchen",13
"453308909160103936",2014-04-07,"Monday",1,0,"Dams in the United States from the National Inventory of Dams (NID) Database","http://t.co/9X8toM37js","Gopi Goteti",1
"453210359587819520",2014-04-07,"Monday",12,4,"R jobs (April 7th 2014): Last month I announced the launch of, a new R jobs website for R users, calle...","http://t.co/Q08CM3z1PJ","Tal Galili",20
"452848418948272128",2014-04-06,"Sunday",8,5,"Author inflation in academic literature","http://t.co/hV59HViwjV","benjaminlmoore",18
"452670878795313153",2014-04-06,"Sunday",8,4,"On the rise of Big Data and Data Science","http://t.co/mIrhJ6KdFR","tlfvincent",16
"452593048061349889",2014-04-05,"Saturday",6,2,"Analyzing VC investment strategies with Crunchbase data","http://t.co/v4rrKIopvw","Benedikt Koehler",10
"452361330666655744",2014-04-05,"Saturday",5,2,"Making inferences about unusual population quantities.","http://t.co/5kono34NZX","BioStatMatt",9
"452165230663987201",2014-04-04,"Friday",3,1,"The Collatz Fractal","http://t.co/qsKW1nRLxs","aschinchon",5
"452195338921586688",2014-04-04,"Friday",6,1,"Flip the script, or, the joys of coord_flip()","http://t.co/ZljgzyeMEl","Dan Mirman",8
"451876997371670528",2014-04-04,"Friday",7,1,"Introduction to Data Science with R, April 28-29 San Francisco","http://t.co/EPL8JL5k6R","rwo2014",9
"452205600521199617",2014-04-04,"Friday",12,3,"Develop in RStudio, run in RScript","http://t.co/Rep7Aa6yRb","What is this? David Sp...",18
"452205601288757248",2014-04-04,"Friday",21,4,"Functional programming in R","http://t.co/usONMq2vhw","What is this? David Sp...",29
"452205599531335681",2014-04-04,"Friday",6,1,"Mapping academic collaborations in Evolutionary Biology","http://t.co/vTaCJKgc5C","What is this? David Sp...",8
"452205603062939648",2014-04-04,"Friday",5,0,"Scraping organism metadata for Treebase repositories from GOLD using Python and R","http://t.co/bLHc2etvQG","What is this? David Sp...",5
"452205602018574336",2014-04-04,"Friday",19,3,"Two R tutorials for beginners","http://t.co/GAUPWauwY1","What is this? David Sp...",25
"451915898362679296",2014-04-04,"Friday",0,0,"Le Monde puzzle [#860]","http://t.co/oYDountx2f","xi'an",0
"451680598554185728",2014-04-03,"Thursday",5,2,"Inference for ARCH processes","http://t.co/CmW9atvEWq","arthur charpentier",9
"451734710985560064",2014-04-03,"Thursday",5,3,"Does R have too many packages?","http://t.co/tk7vV9XAOQ","Francis Smart",11
"451795425284980736",2014-04-03,"Thursday",12,5,"Some R Resources for GLMs","http://t.co/IZ7eWwIEz9","Joseph Rickert",22
"451240205194772480",2014-04-02,"Wednesday",12,3,"Kaplan-Meier plots using ggplots2 (updated)","http://t.co/UOFPjN4LZY","Abhijit",18
"451440383650586628",2014-04-02,"Wednesday",10,9,"Seven quick facts about R","http://t.co/X1e6fvT9pp","David Smith",28
"450970919075201024",2014-04-01,"Tuesday",0,0,"Daylight Saving Effect on S&amp;P500 and FTSE100","http://t.co/hkLxdnkF8m","andrew",0
"450934435278381056",2014-04-01,"Tuesday",8,3,"analyze the european social survey (ess) with r","http://t.co/SWZimgbaaT","Anthony Damico",14
"451085749685735425",2014-04-01,"Tuesday",7,1,"IV Estimates via GMM with Clustering in R","http://t.co/GIWgzvCzkT","diffuseprior",9
"451144635994226690",2014-04-01,"Tuesday",14,6,"Stata Fully Mapped into R","http://t.co/6CZvrLJRLX","Francis Smart",26
"451138353996394496",2014-04-01,"Tuesday",9,3,"Mapping the March 2014 California Earthquake with ggmap","http://t.co/kKs3eRueiQ","hrbrmstr",15
"451113141011632129",2014-04-01,"Tuesday",9,2,"You don’t need to understand pointers to program using R","http://t.co/aP19HNvtxm","John Mount",13
"450953324829761536",2014-04-01,"Tuesday",3,2,"Calendar charts with googleVis","http://t.co/XE0paLqlwi","Markus Gesmann",7
"450958318874271744",2014-04-01,"Tuesday",3,2,"Include uncertainty in a financial model","http://t.co/QA18jwSTx4","simonraper",7
"450828757297672193",2014-04-01,"Tuesday",9,3,"Capturing Intraday data, Backup plan","http://t.co/ARCeckJ7qF","systematicinvestor",15
"450744461811646464",2014-03-31,"Monday",13,0,"Process and observation uncertainty explained with R","http://t.co/44r21imcCD","beckmw",13
"450724516671393792",2014-03-31,"Monday",4,0,"Moustache target distribution and Wes Anderson","http://t.co/YSpnxImDVj","Pierre Jacob",4
"450601112937054208",2014-03-31,"Monday",8,2,"Probabilistic Momentum with Intraday data","http://t.co/U5lwoUMshu","systematicinvestor",12
"450257492665040897",2014-03-30,"Sunday",5,3,"Looking at Measles Data in Project Tycho","http://t.co/a1liGJBmqn","Wingfeet",11
"450012200472559616",2014-03-29,"Saturday",1,0,"R/Finance 2014 Registration Open","http://t.co/JMJaeZINjz","Joshua Ulrich",1
"450012201328205824",2014-03-29,"Saturday",9,1,"Introduction to PortfolioAnalytics","http://t.co/fHHEVYwLzA","Ross",11
"450053669233254401",2014-03-29,"Saturday",4,1,"R / Finance 2014 Open for Registration","http://t.co/56e0RyP9v6","Thinking inside the box",6
"449645944322019328",2014-03-28,"Friday",4,1,"R Training for SAS users in Singapore and online","http://t.co/YaF1xh7MqV","David Smith",6
"449599478819864576",2014-03-28,"Friday",5,1,"Slopegraphs | rCharts –&gt; maybe finance versions","http://t.co/2KBrgOe75y","klr",7
"449653856486428672",2014-03-28,"Friday",7,2,"Theil’s Blus Residuals and R Tools for Testing and Removing Autocorrelation and Heteroscedasticity: Gu...","http://t.co/jArLNasNR7","Tal Galili",11
"449413174647746562",2014-03-28,"Friday",4,1,"Upcoming Rcpp talks and workshops","http://t.co/meLJXghZ4Y","Thinking inside the box",6
"449567929470701568",2014-03-28,"Friday",21,7,"A Simple Introduction to the Graphing Philosophy of ggplot2","http://t.co/R4ObXJGzQT","Thomas Hopper",35
"449146420981813248",2014-03-27,"Thursday",7,0,"sjPlot 1.3 available #rstats #sjPlot","http://t.co/8KauB794LO","Daniel",7
"449301154510299138",2014-03-27,"Thursday",8,0,"Data Preparation – Part II","http://t.co/EimJzh2HlL","Flavio Barros",8
"449278714610610177",2014-03-27,"Thursday",11,7,"New Shiny website launched; Shiny 0.9 released","http://t.co/78M8zun1IK","Joe Cheng",25
"449261224958492672",2014-03-27,"Thursday",1,1,"R User Group Activity for Q1 2014","http://t.co/lPbSsag0lQ","Joseph Rickert",3
"449037018165559296",2014-03-27,"Thursday",7,2,"Visualising Pandas DataFrames With IPythonBlocks – Proof of Concept","http://t.co/tlE1Zm9t10","Tony Hirst",11
"448763130546376704",2014-03-26,"Wednesday",16,4,"R 101: Summarizing Data: When working with large amounts of data that is structured in a tabular forma...","http://t.co/ha2oNITECv","atmathew",24
"448968309216526338",2014-03-26,"Wednesday",11,7,"MCMC for Econometrics Students – Part IV","http://t.co/cpouKjn1tJ","Dave Giles",25
"448839409262022656",2014-03-26,"Wednesday",13,5,"How to open an SPSS file into R","http://t.co/RnmFd8XNiH","Davide Massidda",23
