"id","date","day","favorites","retweets","title","url","author","score"
"509929397520834560",2014-09-11,"Thursday",12,5,"More presentations from useR! 2014","http://t.co/NcgRGlWTBf","David Smith",22
"509856398725758977",2014-09-11,"Thursday",15,9,"R version of “An exploratory technique for visualizing the distributions of 100 variables:”","http://t.co/Avzr6DwtJr","hrbrmstr",33
"509902984654757888",2014-09-11,"Thursday",4,0,"Intermission: A Quick Thought on Robust Kurtosis","http://t.co/d7b2tJazNb","Ilya Kipnis",4
"510159623957929985",2014-09-11,"Thursday",1,1,"R at Conferences this Fall","http://t.co/SqdgsnLAGK","Joseph Rickert",3
"509915517428039680",2014-09-11,"Thursday",3,2,"Generalized Double Pareto Priors for Regression","http://t.co/jowWonfMYa","Lindons Log » R",7
"509875256962473984",2014-09-11,"Thursday",18,9,"CausalImpact: A new open-source package for estimating causal effects in time series","http://t.co/A6on76m0VK","Mary Radomile",36
"509891611501678592",2014-09-11,"Thursday",9,4,"Visualizing Website Pathing With Sankey Charts","http://t.co/gPVlKxZwlW","Randy Zwitch",17
"510119420081876993",2014-09-11,"Thursday",10,1,"Save your simulation study seeds","http://t.co/JjfLyZ11lc","Robert",12
"509855230289141760",2014-09-11,"Thursday",0,1,"LA R Meetup Summary: Highlights from the useR! 2014 Conference","http://t.co/pGpC9k3EwV","Szilard",2
"509889104905904128",2014-09-11,"Thursday",2,1,"pkgKitten 0.1.1: Still creating R Packages that purr","http://t.co/4WpzDgwvRS","Thinking inside the box",4
"510189865581830144",2014-09-11,"Thursday",2,2,"pkgKitten 0.1.2: Still creating R Packages that purr","http://t.co/mV4nFpcGtH","Thinking inside the box",6
"509593410013900800",2014-09-10,"Wednesday",1,1,"Transport Map Book","http://t.co/lZkbnfeTAH","Alex Singleton - R",3
"509496519255277568",2014-09-10,"Wednesday",3,5,"Brazilian Presidential Election","http://t.co/1YSGq0DHa6","Daniel Marcelino",13
"509768622835654656",2014-09-10,"Wednesday",1,0,"4 new R jobs (for September 10th 2014) and a new ""about us"" video","http://t.co/gXlddkJHCq","Tal Galili",1
"509354327706959872",2014-09-09,"Tuesday",0,0,"Heather Turner, the useR! 2014 Interview","http://t.co/7ttDsiMBgx","Eduardo Ariño de la Rubia",0
"509203313854656512",2014-09-09,"Tuesday",10,3,"Track how visitors use your Shiny app with Google Analytics","http://t.co/uB1hB2nVHs","Garrett.Grolemund",16
"509247402012729344",2014-09-09,"Tuesday",3,2,"Nuts and Bolts of Quantstrat, Part I","http://t.co/77y5b6ej1P","Ilya Kipnis",7
"509490217317699584",2014-09-09,"Tuesday",2,0,"The Collatz Conjecture Continued","http://t.co/zDlWZsgTYx","Joseph Rickert",2
"509316786454409216",2014-09-09,"Tuesday",0,0,"Bay Area Real Estate (cont.)","http://t.co/YiJrWthWSx","Posts by greenberg.jon...",0
"509426040377053184",2014-09-09,"Tuesday",4,1,"ASDAR book Review","http://t.co/DmbnKibUre","Robin Lovelace - R",6
"509190738341396480",2014-09-09,"Tuesday",8,4,"Spatial Clustering: Conley Standard Errors for R","http://t.co/v2zUdjzJar","Thiemo Fetzer",16
"509036002673823744",2014-09-08,"Monday",10,6,"Build a SPAM filter with R","http://t.co/lhwEcKhs9n","julianhi",22
"509092602944049152",2014-09-08,"Monday",5,3,"Visualizing Website Pathing With Network Graphs","http://t.co/cQeM5TvNYy","Randy Zwitch",11
"508974369775710208",2014-09-08,"Monday",5,4,"Generating quantile forecasts in R","http://t.co/SaqnF1lsd6","Rob J Hyndman",13
"508498700625121280",2014-09-07,"Sunday",2,0,"Offense or defense improve likelihood of becoming bowl eligible?","http://t.co/tLMLdpLjj8","Educate-R - R",2
"508760429770723329",2014-09-07,"Sunday",23,8,"An exercise in non-linear modeling","http://t.co/SBQkYPEdyU","Max Gordon",39
"508588084800143361",2014-09-07,"Sunday",13,7,"Slides of 12 tutorials at ACM SIGKDD 2014","http://t.co/A6NwTq6XZt","Yanchang Zhao",27
"508048212637122561",2014-09-06,"Saturday",5,3,"shinyTree: jsTree + shiny","http://t.co/WSC6vq3AdU","Jeff Allen",11
"508148881205374977",2014-09-06,"Saturday",1,4,"jsonlite gets a triple mushroom boost!","http://t.co/YYo2YJ5a9s","Jeroen Ooms",9
"508191656395288576",2014-09-06,"Saturday",2,1,"Packrat on CRAN","http://t.co/K6fpvtKQbH","Kevin Ushey",4
"508263373146841088",2014-09-06,"Saturday",5,7,"Good for TI, Good for Schools, Bad for Kids, Bad for Stat","http://t.co/cpb4n3HeON","matloff",19
"508028089259945984",2014-09-05,"Friday",3,2,"Crowded Cities, Paris, Hong Kong and Montréal","http://t.co/ni7i7wkDMV","arthur charpentier",7
"508014246886514688",2014-09-05,"Friday",10,3,"Keep your team informed with “slackr”","http://t.co/0hn9sOx60l","Bob Rudis (@hrbrmstr)",16
"507907297540988928",2014-09-05,"Friday",1,3,"In case you missed it: August 2014 Roundup","http://t.co/mFck7d9h1x","David Smith",7
"507718589189603328",2014-09-05,"Friday",10,9,"Shiny: R made interactive @ useR! 2014","http://t.co/jCuhT5646y","Eduardo Ariño de la Rubia",28
"507689595522129920",2014-09-05,"Friday",1,0,"Long Memory and the Nile: Herodotus, Hurst and H","http://t.co/Bgk0IURyOS","Joseph Rickert",1
"507941259558662144",2014-09-05,"Friday",3,1,"Error notifications from R","http://t.co/WyRjkCQM2M","Karl Broman",5
"507690850944442368",2014-09-05,"Friday",3,4,"Spell Checker for R…qdap::check_spelling","http://t.co/wdcKf5eGVV","tylerrinker",11
"507450540981121025",2014-09-04,"Thursday",4,2,"Looking For Life","http://t.co/luFwXnyF78","aschinchon",8
"507342312523841537",2014-09-04,"Thursday",11,6,"Introducing simmer: Discrete Event Simulation for R","http://t.co/vBImwcKP3F","Bart",23
"507376275543953408",2014-09-04,"Thursday",3,2,"Adding the SPSS MEAN.n Function to R","http://t.co/gTw60cxWEd","Bob Muenchen",7
"507361204264644608",2014-09-04,"Thursday",0,3,"Brazilian Presidential Election","http://t.co/G08Tu63YFn","Daniel Marcelino",6
"507359926310543361",2014-09-04,"Thursday",1,3,"Hortonworks Seminar Series: The Modern Data Architecture","http://t.co/M4A1S3SRMy","David Smith",7
"507513500382412802",2014-09-04,"Thursday",15,6,"Google Charts in R Markdown","http://t.co/4YfHqjoH5Q","Homer White",27
"507324696405106688",2014-09-04,"Thursday",12,4,"Notifications from R","http://t.co/KaQqzFKd6F","Karl Broman",20
"507655648205479936",2014-09-04,"Thursday",3,2,"2014-02 Invertible Reproducible Documents","http://t.co/A00tUBRPjQ","pmur002",7
"507669467124334592",2014-09-04,"Thursday",10,2,"Bayesian First Aid: Poisson Test","http://t.co/1cVeoxqOs0","Rasmus Bååth",14
"507470174228733954",2014-09-04,"Thursday",0,3,"LAST CHANCE TO REGISTER FOR EARL (15-17 September, London)","http://t.co/7ZT7cKGP8N","Tal Galili",6
"507051648858873856",2014-09-03,"Wednesday",5,2,"Baseball: Probability of winning conditional on runs, hits, walks and errors","http://t.co/QsDWEAVxsq","dan",9
"507098216492318720",2014-09-03,"Wednesday",0,0,"Comparing ifelse with C++ for loop with ifs","http://t.co/aSdfdcqzVG","ECONinfo » Rblogger",0
"507098302718812160",2014-09-03,"Wednesday",1,1,"PS: Clustering whiskies","http://t.co/xAAUb3OiwY","ECONinfo » Rblogger",3
"507098262277328896",2014-09-03,"Wednesday",2,1,"SAS on the road","http://t.co/UvnyKq0KAD","ECONinfo » Rblogger",4
"507098203645161474",2014-09-03,"Wednesday",0,0,"Scratching that itch from ifelse","http://t.co/6T5Qbd8ifD","ECONinfo » Rblogger",0
"507098235203100673",2014-09-03,"Wednesday",1,0,"Shoutout for Atlassian","http://t.co/FQ4KuuPVaX","ECONinfo » Rblogger",1
"507244169710927872",2014-09-03,"Wednesday",0,0,"rNOMADS 2.0.2 released","http://t.co/Bcy2D1QBgk","glossarch",0
"507169914243657728",2014-09-03,"Wednesday",1,1,"httr 0.5","http://t.co/hGWvZxrhdu","hadleywickham",3
"506961047580708865",2014-09-03,"Wednesday",6,2,"Using R to simulate the finances of public sector pension funds","http://t.co/xc9BIuVq3Y","Joseph Rickert",10
"507018933006651393",2014-09-03,"Wednesday",3,0,"The Importance of ‘Janitorial Work’ in Research","http://t.co/2ue94S8AYa","Leigh Arino de la Rubia",3
"506958528028749824",2014-09-03,"Wednesday",2,0,"""sinkr"" - a collection of functions featured on ""me nugget""","http://t.co/dqZAhN7uk9","Marc in the box",2
"507148561696317440",2014-09-03,"Wednesday",0,0,"Resources for the FPP book","http://t.co/YH1RuYgDHZ","Rob J Hyndman",0
"507018938484408320",2014-09-03,"Wednesday",0,1,"Win Books and T-shirts in Our DataScience.LA Meetup Raffles, Powered by R and dplyr!","http://t.co/QPkHMxqI8G","Szilard",2
"507012637251469312",2014-09-03,"Wednesday",1,0,"littler is faster at doing nothing!","http://t.co/7aFnAmQtGV","Thinking inside the box",1
"506842758837837824",2014-09-02,"Tuesday",26,15,"New R course on Coursera: Data Analysis and Statistical Inference","http://t.co/rAB84KXbXr","DataCamp",56
"506602429979168768",2014-09-02,"Tuesday",10,3,"Yihui Xie, the useR! 2014 Interview","http://t.co/RS25qg1tbq","Eduardo Ariño de la Rubia",16
"506928363651358720",2014-09-02,"Tuesday",0,0,"The Limit of ATR Order Sizing","http://t.co/NbEDOpuCoP","Ilya Kipnis",0
"506637714502848514",2014-09-02,"Tuesday",1,0,"Labor day distribution fun","http://t.co/sp2EE0VLaq","Matt Asher",1
"506725758438363136",2014-09-02,"Tuesday",1,4,"RSiteCatalyst Version 1.4 Release Notes","http://t.co/YRObEZTpav","Randy Zwitch",9
"506620057183469568",2014-09-02,"Tuesday",3,2,"littler 0.2.0","http://t.co/VpcEeTAiPn","Thinking inside the box",7
"506700593147043841",2014-09-02,"Tuesday",3,3,"Rmetrics Software News","http://t.co/G8FO3vQyvy","tsetz",9
"506549592167444480",2014-09-01,"Monday",0,1,"Points Per Touch (PPT): Running Backs","http://t.co/F1dUMiPcoz","JC Newton",2
"506335725512433664",2014-09-01,"Monday",11,5,"MongoDB – State of the R","http://t.co/XzImhgfXFd","Raffael Vogler",21
"506314309308145664",2014-09-01,"Monday",7,9,"A new candidate for worst figure","http://t.co/KaMu1klkr4","Rob J Hyndman",25
"506187188233437184",2014-08-31,"Sunday",5,3,"Introducing H2O Lagrange (2.6.0.11) to R","http://t.co/9EvAu7iYkq","0xdata Blog",11
"505934292888080384",2014-08-31,"Sunday",2,1,"Forecasts After Marina's Turbulence","http://t.co/UcWhUitkWs","Daniel Marcelino",4
"505876406971011073",2014-08-31,"Sunday",23,8,"Five Reasons to Teach Elementary Statistics With R:  #1","http://t.co/pkDZ5GFUmI","Homer White",39
"505876402982227968",2014-08-31,"Sunday",15,5,"Five Reasons to Teach Elementary Statistics With R:  #2","http://t.co/omYRNmUNCi","Homer White",25
"505876397680635904",2014-08-31,"Sunday",19,4,"Five Reasons to Teach Elementary Statistics With R:  #3","http://t.co/8l4QYE9Vq6","Homer White",27
"505876393717014528",2014-08-31,"Sunday",3,3,"New Wine in an Old Bottle:  R Markdown v2 and R Studio on the Cent OS Server","http://t.co/8ZYzArydRn","Homer White",9
"505876412251635712",2014-08-31,"Sunday",10,0,"Pander/Pandoc for Pretty Conversion on the R Studio Server","http://t.co/ZKNJQnQ7mY","Homer White",10
"506028660197834752",2014-08-31,"Sunday",6,2,"Periodic matrix model for annual plant demography","http://t.co/8CzhOVfU0K","tomizono",10
"505622220522024961",2014-08-30,"Saturday",3,0,"Because it's Friday: A 3-minute movie in 4095 bytes","http://t.co/TPZ4hyrTlR","David Smith",3
"505779518536040448",2014-08-30,"Saturday",1,1,"Age-Length Keys in FSA","http://t.co/Vtm3BHkCDm","dogle",3
"505607169341804544",2014-08-30,"Saturday",6,4,"Emacs Starter Kit for the Social Sciences: Now Easier to Install","http://t.co/uF3WPKhrC7","Kieran Healy",14
"505756869575458816",2014-08-30,"Saturday",9,5,"Post 0: Getting Started with R","http://t.co/cbqvYbxf6b","Nathan VanHoudnos",19
"505614996231823361",2014-08-30,"Saturday",10,1,"Post 1: A Bayesian 2PL IRT model","http://t.co/zjtlJREr8I","Nathan VanHoudnos",12
"505614739322322944",2014-08-30,"Saturday",4,0,"Post 2: Generating fake data","http://t.co/XtBddeg1BO","Nathan VanHoudnos",4
"505614720838029313",2014-08-30,"Saturday",4,0,"Post 3: Setting up the sampler and visualizing its output","http://t.co/Gvwg78DOpZ","Nathan VanHoudnos",4
"505614704140500992",2014-08-30,"Saturday",5,0,"Post 4: Sampling the person ability parameters","http://t.co/lj9Xqufof6","Nathan VanHoudnos",5
"505614695529603072",2014-08-30,"Saturday",5,0,"Post 5: Refactoring Part I: a generic Metropolis-Hastings sampler","http://t.co/Ql6pkk0e5x","Nathan VanHoudnos",5
"505614691947642880",2014-08-30,"Saturday",5,0,"Post 6: Refactoring Part II: a generic proposal function","http://t.co/dhUoyhteNp","Nathan VanHoudnos",5
"505614687816273920",2014-08-30,"Saturday",6,0,"Post 7: Sampling the item parameters with generic functions","http://t.co/LxfZ8Rbt7i","Nathan VanHoudnos",6
"505614684037210112",2014-08-30,"Saturday",4,0,"Post 8: Sampling the variance of person ability with a Gibbs step","http://t.co/V4v3IudtFW","Nathan VanHoudnos",4
"505614680119705600",2014-08-30,"Saturday",5,0,"Post 9: Tuning the complete sampler","http://t.co/fnhZhfiboJ","Nathan VanHoudnos",5
"505719162035904512",2014-08-30,"Saturday",7,6,"pbapply()","http://t.co/PB5hzNhveg","Posts by greenberg.jon...",19
"505624733522481152",2014-08-30,"Saturday",0,1,"BH release 1.54.0-4","http://t.co/yrMTn6e9Ns","Thinking inside the box",2
"505385684983492610",2014-08-29,"Friday",0,0,"The Andrica’s Conjecture","http://t.co/tZIV8aQ9Wi","aschinchon",0
"505365603037634560",2014-08-29,"Friday",1,1,"How unusual is it for TLDs to resolve to an address at the top most level? (a.k.a. a sneaky, basic","http://t.co/1GRxCno9Hg","Bob Rudis (@hrbrmstr)",3
"505375637020758016",2014-08-29,"Friday",0,1,"R tops KDNuggets data analysis software poll for 4th consecutive year","http://t.co/sGHGvNCYKV","David Smith",2
"505379399886045184",2014-08-29,"Friday",8,4,"Matt Dowle’s data.table Talk from useR! 2014","http://t.co/P3RmY7aJCt","Eduardo Ariño de la Rubia",16
"505408359105720320",2014-08-29,"Friday",7,5,"A Brief Introduction to Plotly","http://t.co/NqwHCntlJx","guest",17
"505371854253457408",2014-08-29,"Friday",3,1,"Comparing ATR order sizing to max dollar order sizing","http://t.co/O4FNXHtasa","Ilya Kipnis",5
"505394505768390656",2014-08-29,"Friday",2,2,"Launching DATA-COPE","http://t.co/XqnBCeBzFY","Jared Knowles",6
"505375661511303171",2014-08-29,"Friday",2,1,"R User Group Roundup","http://t.co/zq8giGJEwe","Joseph Rickert",4
"505437323928940544",2014-08-29,"Friday",9,3,"Yet another R package primer","http://t.co/z7jWvNNFzC","Karl Broman",15
"504835811997528065",2014-08-28,"Thursday",2,1,"DataScienceLA interviews David Smith","http://t.co/dFOWu0eYQa","David Smith",4
"504689884334784512",2014-08-27,"Wednesday",4,0,"R Workshops Updated to Include the Latest Packages","http://t.co/OWmW83a2sD","Bob Muenchen",4
"504750248929943552",2014-08-27,"Wednesday",4,4,"statebins - U.S. State Cartogram Heatmaps in R","http://t.co/CJYADlSrBW","Bob Rudis (@hrbrmstr)",12
"504467129375019008",2014-08-27,"Wednesday",10,0,"TTTAR2: My First Shiny App with Bootstrap - #RUGSMAPS","http://t.co/Lt8SjCxuGX","Jo-fai Chow",10
"504475918484516864",2014-08-27,"Wednesday",6,3,"Statistics: Losing Ground to CS, Losing Image Among Students","http://t.co/0Ybud93dWS","Joseph Rickert",12
"504307325750890498",2014-08-26,"Tuesday",14,11,"Coursera course on computational finance with R","http://t.co/gTKC6MZzMz","DataCamp",36
"504123611666321408",2014-08-26,"Tuesday",17,6,"The Chi-Squared Test of Independence – An Example in Both R and SAS","http://t.co/YmBdOAVTPI","Eric Cai - The Chemica...",29
"504122345800212480",2014-08-26,"Tuesday",2,1,"Do Massive Workloads Equal Big Declines in Running Back Productivity?","http://t.co/6R0reEmsjX","JC Newton",4
"504406750733139968",2014-08-26,"Tuesday",10,2,"Reading the Gauss-Markov theorem","http://t.co/Ad0MRktWXZ","John Mount",14
"504197838675251202",2014-08-26,"Tuesday",9,11,"Statistics:  Losing Ground to CS, Losing Image Among Students","http://t.co/1Fiq2TGJ9U","matloff",31
"503943671046082560",2014-08-25,"Monday",24,7,"Some love for ggplot2","http://t.co/LHK5kOfCRq","beckmw",38
"503956268172574720",2014-08-25,"Monday",3,1,"David Smith, the useR! 2014 Interview","http://t.co/yVVTQwI5is","Eduardo Ariño de la Rubia",5
"503994077117837313",2014-08-25,"Monday",3,2,"Of Needles and Haystacks: Building an Accurate Statewide Dropout Early Warning System in Wisconsin","http://t.co/6DModFeHpZ","Jared Knowles",7
"503693256996048896",2014-08-25,"Monday",2,1,"New in OpenCPU 1.4.4: session namespaces","http://t.co/em5Q8j1d3T","Jeroen Ooms",4
"503830460258992128",2014-08-25,"Monday",7,4,"Forecasting with R in WA","http://t.co/HAjBNw2aCC","Rob J Hyndman",15
"503915085748641792",2014-08-25,"Monday",1,2,"8 new R jobs (for Augest 25th 2014)","http://t.co/OlLn3GSNjI","Tal Galili",5
"503725998966206465",2014-08-25,"Monday",2,2,"R: Stem (Pre-Processed) Text Blocks","http://t.co/IyCQxhnPhP","Tony Breyal",6
"503675659517186048",2014-08-24,"Sunday",11,5,"Computational Actuarial Science, with R","http://t.co/45DYW4m5pD","arthur charpentier",21
"503361078919581696",2014-08-24,"Sunday",7,0,"VCI — The Value Charts Indicator","http://t.co/Z6eFyx8wR9","Ilya Kipnis",7
"502983641010429952",2014-08-23,"Saturday",3,3,"More ESA 2014 Program Text-Mining: Topics as Communities","http://t.co/6Xt1MGIUae","Noam Ross",9
"503205083031429122",2014-08-23,"Saturday",4,6,"Running “Native” Data Wrangling Applications in the Browser – IPython Notebooks (and R?) in","http://t.co/Lxv58T9biM","Tony Hirst",16
"502672799287103488",2014-08-22,"Friday",1,1,"Announcing dtupdate v1.0 - R Package Reporter/Updater for the devtools Universe","http://t.co/ni7ZdLOObW","Bob Rudis (@hrbrmstr)",3
"502846427253329920",2014-08-22,"Friday",5,1,"Entering the field as a data scientist with certification","http://t.co/VxoBAsp5Q7","David Smith",7
"502675301319446528",2014-08-22,"Friday",1,3,"R in Production – Opening Talk by Yasmin Lucero – LA R meetup @ useR! 2014","http://t.co/QHdjqcXkBz","Eduardo Ariño de la Rubia",7
"502675298962243584",2014-08-22,"Friday",0,5,"R in Production – Panel Discussion – LA R meetup @ useR! 2014","http://t.co/19myyLELtv","Eduardo Ariño de la Rubia",10
"502757097897881601",2014-08-22,"Friday",3,2,"stringdist 0.8: now with soundex","http://t.co/wP5CNQv3vs","mark",7
"502944619928100865",2014-08-22,"Friday",0,2,"Pro Grammar and Devel Hoper","http://t.co/J5EIuY8rji","romain francois",4
"502661460128829440",2014-08-22,"Friday",2,1,"RcppEigen 0.3.2.2.0","http://t.co/YDMqmQGxDJ","Thinking inside the box",4
"502282770815545344",2014-08-21,"Thursday",2,1,"Open iTerm (OS X) to a Directory from R","http://t.co/NkDdNZx7P0","Bob Rudis (@hrbrmstr)",4
"502505464404258816",2014-08-21,"Thursday",3,0,"Revolution Analytics' User Group Map Contest has a Winner","http://t.co/V5SME3eJY3","Joseph Rickert",3
"502359491665358849",2014-08-21,"Thursday",4,2,"For Loop Tracking (Windows Progress Bar)","http://t.co/vM5UjaIup1","Posts by greenberg.jon...",8
"501956899328126977",2014-08-20,"Wednesday",1,2,"I like you and you like me…but what does it all mean. (Part 1)","http://t.co/glLcxeqDdA","atmathew",5
"502087737369829378",2014-08-20,"Wednesday",5,18,"R Passes SPSS in Scholarly Use, Stata Growing Rapidly","http://t.co/J0HsqRl3zq","Bob Muenchen",41
"502199677249286145",2014-08-20,"Wednesday",15,3,"How to integrate R with your calendar","http://t.co/4091COSsQF","David Smith",21
"502090204857921536",2014-08-20,"Wednesday",1,1,"CRAN release jsonlite 0.9.10 (RC)","http://t.co/FfxuYvHABn","Jeroen Ooms",3
"501992052951744512",2014-08-20,"Wednesday",11,6,"Integrating R with production systems using an HTTP API","http://t.co/tVPS1sHjiT","Joseph Rickert",23
"501987053660164096",2014-08-20,"Wednesday",1,1,"RcppArmadillo 0.4.400.0","http://t.co/B7ILBCJBQj","Thinking inside the box",3
"501945501759987712",2014-08-20,"Wednesday",29,17,"dplyr: A gamechanger for data manipulation in R","http://t.co/oPji6ZmAgB","Wallace Campbell",63
"501945515253055488",2014-08-20,"Wednesday",9,1,"GBMs are awesome: Part I","http://t.co/8AHPG61Kue","Wallace Campbell",11
"501916604251131904",2014-08-20,"Wednesday",2,0,"Recent Articles","http://t.co/ZY1nrotJsS","Wesley",2
"501798289440649216",2014-08-19,"Tuesday",1,0,"analyze the programme for the international assessment of adult competencies (piaac) with r","http://t.co/U2RP5qDP2N","Anthony Damico",1
"501827285607923714",2014-08-19,"Tuesday",4,0,"Visualize pre-post comparison of intervention #rstats","http://t.co/LXFAOiNasc","Daniel",4
"501551668853358594",2014-08-19,"Tuesday",3,3,"What are the Odds of an Independent Scotland?","http://t.co/UGZr7M0vEV","Daniel Marcelino",9
"501807089669242880",2014-08-19,"Tuesday",3,2,"Hijacking R Functions: Changing Default Arguments","http://t.co/KtEUQgF2YN","tylerrinker",7
"501798328800002048",2014-08-19,"Tuesday",2,3,"Introducing Rfiglet: ASCII logos from the comfort of R","http://t.co/oXD4THeD0p","wrathematics",8
"501167900430852097",2014-08-18,"Monday",0,0,"Changes to FSA — Estimating Abundance","http://t.co/eIyHf6KgkB","dogle",0
"501449212047790080",2014-08-18,"Monday",2,4,"A Conversation with Tal Galili at useR! 2014","http://t.co/zIIuPRaggj","Eduardo Ariño de la Rubia",10
"501449193039200257",2014-08-18,"Monday",1,1,"Announcing the DSLA Podcast!","http://t.co/IGtv2Uqh0U","Eduardo Ariño de la Rubia",3
"501492519570391040",2014-08-18,"Monday",3,1,"A Hammer Trading System — Demonstrating Custom Indicator-Based Limit Orders in Quantstrat","http://t.co/4gWrawxB94","Ilya Kipnis",5
"501252223200792577",2014-08-18,"Monday",2,0,"GEFCom 2014 energy forecasting competition is underway","http://t.co/lheYmHzPui","Rob J Hyndman",2
"500974127658725376",2014-08-17,"Sunday",4,2,"A Matrix Powers Package, and Some General Edifying Material on R","http://t.co/tjfoHQCpGa","matloff",8
"501076030220533761",2014-08-17,"Sunday",15,9,"21 R navigation tools","http://t.co/iCrDCZs2R7","Patrick Burns",33
"501146516703031297",2014-08-17,"Sunday",1,0,"Hayward/San Leandro Housing Prices","http://t.co/fS8KlyuCMp","Posts by greenberg.jon...",1
"500721207432323072",2014-08-16,"Saturday",2,3,"San Leandro and Hayward Housing Prices","http://t.co/Sr81ytHN7l","Posts by greenberg.jon...",8
"500777882411864064",2014-08-16,"Saturday",3,1,"Reasonable Inheritance of Cluster Identities in Repetitive Clustering","http://t.co/hPscBveFjm","Raffael Vogler",5
"500127292803145728",2014-08-15,"Friday",10,5,"Plotting Flows with riverplot","http://t.co/4pGQbfauXJ","andrew",20
"500313541396541440",2014-08-15,"Friday",2,0,"Update to resolv (0.1.2) + valgrind and R + Parallel DNS Requests with Revolution R’s ","http://t.co/VPZglYA9lC","Bob Rudis (@hrbrmstr)",2
"500370163724607488",2014-08-15,"Friday",7,6,"Search for CRAN, GitHub and BioConductor packages at http://t.co/Ha34FIp0bY","http://t.co/obM19ReVyM","David Smith",19
"500069406571905028",2014-08-15,"Friday",1,0,"Running OpenCPU server on Fedora and Enterprise Linux","http://t.co/MAFKJSU7oy","Jeroen Ooms",1
"500342446627102721",2014-08-15,"Friday",5,2,"sort.data.frame","http://t.co/um9QwiQGIP","mark",9
"500239314823827460",2014-08-15,"Friday",15,3,"Exploring Hotel Review Data from Trip Advisor with R","http://t.co/IF2yCxvGab","rdabbler",21
"500371386066427904",2014-08-15,"Friday",2,1,"rOpenSci at NESCent Open Tree of Life Hackathon","http://t.co/secvbPNGnl","rOpenSci Blog - R",4
"500170056160919552",2014-08-15,"Friday",0,1,"LA R meetup – September 4: Highlights from the useR! 2014 Conference","http://t.co/Fmfug2hwma","Szilard",2
"500239296306356224",2014-08-15,"Friday",0,0,"STEM forums","http://t.co/H5R8MW6fW2","xi'an",0
"499998938871521281",2014-08-14,"Thursday",18,11,"Winston Chang’s “Interactive Graphics with ggvis” at useR! 2014","http://t.co/T6kS0vQwH0","Eduardo",40
"500022832944799744",2014-08-14,"Thursday",8,2,"Model building with the iris data set for Big Data","http://t.co/qWbfcuMjFZ","Joseph Rickert",12
"499873158212485122",2014-08-14,"Thursday",0,0,"new laptop with ubuntu 14.04","http://t.co/EHG55oEX73","xi'an",0
"499517010460413952",2014-08-13,"Wednesday",1,1,"Summer Summary","http://t.co/Z9l4eXvvZG","aschinchon",3
"499627759706976256",2014-08-13,"Wednesday",0,0,"Knoxville R Users’ Group Meets September 3rd","http://t.co/gIcoQEQmr2","Bob Muenchen",0
"499376086044512256",2014-08-13,"Wednesday",7,4,"New and Updated R Packages for Security Data Science","http://t.co/UvVcJel1EN","Bob Rudis (@hrbrmstr)",15
"499393692709306368",2014-08-13,"Wednesday",1,2,"Strange behavior from the cut function with dates in R","http://t.co/szEvBdR24T","Patrick",5
"499545968123990016",2014-08-13,"Wednesday",0,0,"Visit of Di Cook","http://t.co/SsrVLfdjqJ","Rob J Hyndman",0
"499382377102065665",2014-08-13,"Wednesday",2,0,"Announcing our ambassadors program","http://t.co/qJRwDWZFnc","rOpenSci Blog - R",2
"499540338264920064",2014-08-13,"Wednesday",3,2,"5 new R jobs (for Augest 13th 2014)","http://t.co/4drC3IBmc5","Tal Galili",7
"499432968100655104",2014-08-13,"Wednesday",1,2,"Free R-User Discount Code – TEXATA 2014 Big Data World Championship","http://t.co/gmrCq8Yspw","Tal Galili",5
"499369824095440897",2014-08-13,"Wednesday",0,0,"Bangalore workshop [ಬೆಂಗಳೂರು ಕಾರ್ಯಾಗಾರ] and new book","http://t.co/UCRAaGb2sV","xi'an",0
"499124460079697920",2014-08-12,"Tuesday",9,4,"John Chambers: Interfaces, Efficiency and Big Data","http://t.co/u3n1x9k5C3","David Smith",17
"499028787040755712",2014-08-12,"Tuesday",3,1,"A John Ehlers oscillator — Cycle RSI(2)","http://t.co/ohrKwJi6Sq","Ilya Kipnis",5
"499335828909199360",2014-08-12,"Tuesday",11,4,"Quantitative Finance applications in R - 8","http://t.co/nr26qmNtKt","Joseph Rickert",19
"499334555216523264",2014-08-12,"Tuesday",3,1,"Venn figures go wrong","http://t.co/4mZjAchPHq","nsaunders",5
"499269146475917313",2014-08-12,"Tuesday",2,4,"Fracking in your neighborhood? Shale- Oil and Gas Economic Impact Map","http://t.co/RGmIrOjLlW","Thiemo Fetzer",10
"498767062143995904",2014-08-11,"Monday",9,3,"What your twitter friends say about you and your interests","http://t.co/WJHopS8SFs","Brian Rowe",15
"498948256248782848",2014-08-11,"Monday",7,1,"A Conversation with Max Kuhn – The useR! 2014 Interview","http://t.co/Ie1CqLeafg","Eduardo",9
